{
  "schema_version": "0.1",
  "product_id": "codemonkeys-dash",
  "cadence": "daily",
  "jobs": [
    {
      "intent": "validate",
      "budget": {"max_actions": 1, "max_seconds": 120},
      "stop_conditions": ["on_silverback_fail"],
      "priority": 90
    },
    {
      "intent": "test",
      "budget": {"max_actions": 1, "max_seconds": 300},
      "stop_conditions": ["on_test_fail"],
      "priority": 80
    }
  ],
  "enabled": true
}
